{
  "id": "DECISION-HH-MM-001",
  "version": "2.0",
  "proposedUseId": "USE-HH-MM-001",
  "proposedUseVersion": "2.0",
  "outcome": "hold_approval_required",
  "answer": "Hold the training. Business and Legal Affairs must resolve the client and performer permissions before the recordings enter the training environment.",
  "scopeSummary": "Twelve Harbor Heroes dialogue takes from Ava Lin and Mateo Ruiz, used to train and retain a mouth-shape prediction model for Moss & Moon in MotionMap Lab's Australian private tenant.",
  "gateResults": [
    {
      "gate": "inventory",
      "result": "satisfied",
      "explanation": "The exact recordings and both represented performers are identified in manifest version 3.0.",
      "ruleIds": [
        "RULE-EXACT-INVENTORY"
      ],
      "evidenceIds": [
        "COLLECTION-HH-VOICE-204"
      ],
      "responsibleRole": "Production data steward",
      "basis": [
        {
          "kind": "inventory_verification",
          "evidenceIds": [
            "COLLECTION-HH-VOICE-204"
          ],
          "verifiedBy": "ROLE-DATA-STEWARD",
          "scopeReferences": [
            "USE-HH-MM-001"
          ],
          "explanation": "The exact recordings and both represented performers are identified in manifest version 3.0."
        }
      ]
    },
    {
      "gate": "source_authority",
      "result": "approval_required",
      "explanation": "No verified client permission covers training a retained model for a different production.",
      "ruleIds": [
        "RULE-HH-CROSS-PRODUCTION-APPROVAL"
      ],
      "evidenceIds": [
        "AGREEMENT-HH-PRODUCTION"
      ],
      "responsibleRole": "Business and Legal Affairs",
      "basis": []
    },
    {
      "gate": "contributor_rights",
      "result": "approval_required",
      "explanation": "Ava requires purpose-specific agreement and Mateo's restriction requires an authorised technical and legal interpretation. Collective terms apply separately.",
      "ruleIds": [
        "RULE-AVA-AI-CONSENT",
        "RULE-MATEO-SYNTHETIC-PERFORMANCE"
      ],
      "evidenceIds": [
        "AGREEMENT-AVA-12",
        "AGREEMENT-MATEO-08",
        "COLLECTIVE-AVPC-24",
        "COLLECTIVE-USV-23"
      ],
      "responsibleRole": "Business and Legal Affairs",
      "basis": []
    },
    {
      "gate": "privacy_and_people_impact",
      "result": "approval_required",
      "explanation": "The secondary use of identifiable voice recordings requires a verified purpose-specific privacy basis and contributor process.",
      "ruleIds": [
        "RULE-PERSONAL-DATA-SECONDARY-USE"
      ],
      "evidenceIds": [
        "COLLECTION-HH-VOICE-204"
      ],
      "responsibleRole": "Privacy owner",
      "basis": []
    },
    {
      "gate": "operation",
      "result": "missing_information",
      "explanation": "The learned capability, model retention duration and deletion plan require technical verification before approval can be assessed.",
      "ruleIds": [
        "RULE-PERSISTENT-MODEL-DESCRIPTION"
      ],
      "evidenceIds": [
        "ENV-MOTIONMAP-AU-LAB"
      ],
      "responsibleRole": "ML lead",
      "basis": []
    },
    {
      "gate": "purpose_and_destination",
      "result": "approval_required",
      "explanation": "The destination is company-owned IP and differs from the client production that created the recordings.",
      "ruleIds": [
        "RULE-HH-CROSS-PRODUCTION-APPROVAL"
      ],
      "evidenceIds": [
        "AGREEMENT-HH-PRODUCTION",
        "PRODUCTION-MOSS-AND-MOON"
      ],
      "responsibleRole": "Business and Legal Affairs",
      "basis": []
    },
    {
      "gate": "environment",
      "result": "satisfied",
      "explanation": "The current Australian private tenant configuration is technically approved; source rights and final model retention remain separate unresolved gates.",
      "ruleIds": [
        "RULE-MOTIONMAP-AU-ENVIRONMENT"
      ],
      "evidenceIds": [
        "ENV-MOTIONMAP-AU-LAB",
        "APPROVAL-MOTIONMAP-SECURITY"
      ],
      "responsibleRole": "IT and security",
      "basis": [
        {
          "kind": "technical_verification",
          "evidenceIds": [
            "ENV-MOTIONMAP-AU-LAB",
            "APPROVAL-MOTIONMAP-SECURITY"
          ],
          "verifiedBy": "ROLE-IT-SECURITY",
          "scopeReferences": [
            "USE-HH-MM-001"
          ],
          "explanation": "The current Australian private tenant configuration is technically approved; source rights and final model retention remain separate unresolved gates."
        }
      ]
    },
    {
      "gate": "obligations",
      "result": "approval_required",
      "explanation": "Compensation, consent, collective minimums, model expiry and withdrawal response remain unresolved.",
      "ruleIds": [
        "RULE-AVA-AI-CONSENT",
        "RULE-PERSISTENT-MODEL-DESCRIPTION"
      ],
      "evidenceIds": [
        "AGREEMENT-AVA-12",
        "AGREEMENT-MATEO-08"
      ],
      "responsibleRole": "Decision owner",
      "basis": []
    }
  ],
  "blockers": [
    {
      "id": "BLOCKER-CLIENT-PERMISSION",
      "description": "Obtain and verify client authority for the exact dataset, learned artefact, destination and retention.",
      "ownerId": "ROLE-BUSINESS-LEGAL",
      "timing": "before_processing",
      "evidenceRequired": true
    },
    {
      "id": "BLOCKER-PERFORMER-RIGHTS",
      "description": "Resolve each performer's agreement, consent, compensation and collective requirements.",
      "ownerId": "ROLE-BUSINESS-LEGAL",
      "timing": "before_processing",
      "evidenceRequired": true
    },
    {
      "id": "BLOCKER-TECHNICAL-DESCRIPTION",
      "description": "Approve a technical description of learned capability, memorisation risk, access, retention and deletion.",
      "ownerId": "ROLE-ML-LEAD",
      "timing": "before_processing",
      "evidenceRequired": true
    }
  ],
  "conditions": [],
  "requiredApproverIds": [
    "ROLE-BUSINESS-LEGAL",
    "ORG-STREAMWAVE-KIDS",
    "PERSON-AVA-LIN",
    "PERSON-MATEO-RUIZ",
    "ROLE-PRIVACY"
  ],
  "approvals": [],
  "applicableRuleIds": [
    "RULE-EXACT-INVENTORY",
    "RULE-HH-CROSS-PRODUCTION-APPROVAL",
    "RULE-AVA-AI-CONSENT",
    "RULE-MATEO-SYNTHETIC-PERFORMANCE",
    "RULE-PERSONAL-DATA-SECONDARY-USE",
    "RULE-PERSISTENT-MODEL-DESCRIPTION",
    "RULE-MOTIONMAP-AU-ENVIRONMENT"
  ],
  "evidenceSnapshot": [
    {
      "recordId": "ORG-NORTHSTAR-ANIMATION",
      "version": "1.0",
      "status": "active",
      "verifiedAt": "2026-09-14T00:00:00Z",
      "integrityValue": "sha256:a742c4aa42a0abbc55662c381ce7a4f9dd3dbdac0fcc541152a3239aae4abbb5"
    },
    {
      "recordId": "ORG-STREAMWAVE-KIDS",
      "version": "1.0",
      "status": "active",
      "verifiedAt": "2026-09-14T00:00:00Z",
      "integrityValue": "sha256:fcc396d931aead54d1646073f6e88d62ac18df2843d37d4b3857536c107a3532"
    },
    {
      "recordId": "AGREEMENT-HH-PRODUCTION",
      "version": "2.1",
      "status": "active",
      "verifiedAt": "2026-09-14T00:00:00Z",
      "integrityValue": "sha256:e5d76e0a487aeb5e5ad789f3e47c07fa7bcc3c3158fc98f6095928516677854f"
    },
    {
      "recordId": "AGREEMENT-AVA-12",
      "version": "1.0",
      "status": "active",
      "verifiedAt": "2026-09-14T00:00:00Z",
      "integrityValue": "sha256:4933e5bcef40748ce216523b49e323b05a64c8e2c41e7e8adab856adc3a522f3"
    },
    {
      "recordId": "AGREEMENT-MATEO-08",
      "version": "1.0",
      "status": "active",
      "verifiedAt": "2026-09-14T00:00:00Z",
      "integrityValue": "sha256:e5cea1fcb7dea8d268826efa8d0efa6b4bc12316dc532ece8384959c983b7b48"
    },
    {
      "recordId": "COLLECTIVE-AVPC-24",
      "version": "1.0",
      "status": "active",
      "verifiedAt": "2026-09-14T00:00:00Z",
      "integrityValue": "sha256:539fa95586c2eae3fbf7f1201bb57272dbe8883c581f1cde4faabf0f3275c7a7"
    },
    {
      "recordId": "COLLECTIVE-USV-23",
      "version": "1.0",
      "status": "active",
      "verifiedAt": "2026-09-14T00:00:00Z",
      "integrityValue": "sha256:4c5d9facc3d6fb9eb51d7b065b2c646ba6264f4fa3b9c572c560c75bc5eb5647"
    },
    {
      "recordId": "PERSON-AVA-LIN",
      "version": "1.0",
      "status": "active",
      "verifiedAt": "2026-09-14T00:00:00Z",
      "integrityValue": "sha256:913892a9ae3806a9d769bd9612de0e6f50c83b2cb33e20476c2f4018ebf80fff"
    },
    {
      "recordId": "PERSON-MATEO-RUIZ",
      "version": "1.0",
      "status": "active",
      "verifiedAt": "2026-09-14T00:00:00Z",
      "integrityValue": "sha256:d5a381188e46260d483d202b7eec075682c6e58e3153724aed7ae38b8c5dd27f"
    },
    {
      "recordId": "PRODUCTION-HARBOR-HEROES",
      "version": "1.0",
      "status": "active",
      "verifiedAt": "2026-09-14T00:00:00Z",
      "integrityValue": "sha256:d98055baa6d0c4140dae10a5eaaeb54cb49d526312a5681644e99d18c5f675a4"
    },
    {
      "recordId": "PRODUCTION-MOSS-AND-MOON",
      "version": "1.0",
      "status": "active",
      "verifiedAt": "2026-09-14T00:00:00Z",
      "integrityValue": "sha256:20e3d81a9711f25489fe3fc2992d6b0af083f02bf3c8faf070d493af1fdbdbb1"
    },
    {
      "recordId": "MATERIAL-HH-204-AVA",
      "version": "1.0",
      "status": "active",
      "verifiedAt": "2026-09-14T00:00:00Z",
      "integrityValue": "sha256:857e466160d9c9789059a8391b90bba147026a4e7442bd28f18c18d34c52752b"
    },
    {
      "recordId": "MATERIAL-HH-204-MATEO",
      "version": "1.0",
      "status": "active",
      "verifiedAt": "2026-09-14T00:00:00Z",
      "integrityValue": "sha256:5b4d7d11559ad9af12ae0e6a65515864734a3f1e6fcbdf2c8b380658847a5ed5"
    },
    {
      "recordId": "COLLECTION-HH-VOICE-204",
      "version": "3.0",
      "status": "active",
      "verifiedAt": "2026-09-14T00:00:00Z",
      "integrityValue": "sha256:b0c6995832ea15394e235994f48050bbd8241034b0e98fd46182335fcb4cafc7"
    },
    {
      "recordId": "APPROVAL-MOTIONMAP-SECURITY",
      "version": "1.0",
      "status": "active",